{
  "schema": "madb.lock/1",
  "project_digest": "sha256:1e66a509a391880255ce4e4f217d0a80588fa5444746abed412869780a5873f4",
  "profiles": [
    {
      "id": "rust-c-fixture",
      "semantic_digest": "sha256:70dde7881610c582d49ef26a53cf3e82929622adcf112eb1ab79cc70dd65cfb8",
      "file": {
        "path": "profiles/rust-c.json",
        "sha256": "sha256:f16d05ec6b29248d2c61adb1e9263f78e4f7bace1b955014a2d17872cfe4064d",
        "size": 7,
        "schema": "madb.profile/1"
      }
    }
  ],
  "tools": [
    {
      "id": "fixture-clang",
      "version": "fixture-1",
      "sha256": "sha256:c3a9dacf1e6fe0033c64e83db13445a8828e993ccce8aaf0dcc66957ad053af6",
      "host": "aarch64-apple-darwin",
      "target": "aarch64-apple-darwin",
      "source": "fixture://toolchain",
      "arguments": [
        "-std=c11"
      ]
    }
  ],
  "components": [
    {
      "id": "org.madb.fixture/reader",
      "version": "0.1.0",
      "sha256": "sha256:7e01769b0eefaadeb3be8324a0bbe0b7591478582aae53b9a6f238eec674db89"
    }
  ],
  "inputs": [
    {
      "path": "native/fixture.rs",
      "sha256": "sha256:7e27f1fcded98884ca95fd01459e9dfb2d6cb613fc7f52036bd89e8d32c4b5c0",
      "size": 20
    }
  ],
  "schemas": [
    {
      "path": "schemas/common.schema.json",
      "sha256": "sha256:f16d05ec6b29248d2c61adb1e9263f78e4f7bace1b955014a2d17872cfe4064d",
      "size": 7
    }
  ]
}
